id,category,title,content,keywords
faq_skipping_breakfast,Nutrition FAQ,Is Skipping Breakfast Bad?,"Skipping breakfast isn't inherently harmful, but eating a morning meal is consistently linked to better overall diet quality. Breakfast provides fuel for the day, helps stabilize blood sugar, and can improve focus and concentration. If skipping breakfast leads to low energy or overeating later in the day, it's better to eat a balanced breakfast containing protein, healthy fats, and fiber - for example eggs with whole-grain toast, or Greek yogurt with berries.","breakfast, skipping breakfast, morning meal, blood sugar, balanced breakfast"
faq_carbs_bad,Nutrition FAQ,Are Carbohydrates Bad For You?,"Carbohydrates are not the enemy - they are the body's primary and preferred source of energy. The confusion comes from treating all carbs the same. Healthy carbs, such as minimally processed whole grains, fruits, vegetables, and legumes, are packed with essential nutrients and fiber. Refined carbs, such as sugary beverages, white bread, and pastries, are heavily processed and can spike blood sugar, so they should be consumed in moderation.","carbohydrates, carbs, healthy carbs, refined carbs, whole grains, blood sugar spike"
faq_protein_needs,Nutrition FAQ,How Much Protein Do You Actually Need?,"For most adults, the general baseline recommendation is at least 0.8 grams of protein per kilogram of body weight per day, though many experts suggest somewhat more for optimal health. Athletes, people who exercise regularly, and older adults usually require higher amounts of protein to support muscle repair, growth, and maintenance.","protein requirement, protein needs, grams per kilogram, muscle repair, protein intake"
faq_water_intake,Nutrition FAQ,Do You Really Need 8 Glasses of Water a Day?,"The '8 glasses a day' rule is a reasonable general guideline, but actual fluid needs vary from person to person based on activity level, climate, and body size. A simple way to gauge hydration is to listen to the body and drink when thirsty. Monitoring urine color - aiming for clear or light yellow - is a reliable way to check whether fluid intake is adequate.","water intake, hydration, 8 glasses of water, fluid needs, urine color, thirst"
faq_fats_healthy,Nutrition FAQ,Are All Fats Unhealthy?,"Not all fats are unhealthy - fat is an essential nutrient required to protect organs, produce hormones, and absorb the fat-soluble vitamins A, D, E, and K. Healthy unsaturated fats, found in avocados, nuts, seeds, olive oil, and fatty fish like salmon, offer significant heart-health benefits. Saturated fats (found in fatty meats and butter) and artificial trans fats should be limited, since they can negatively affect cholesterol levels.","dietary fat, unsaturated fat, saturated fat, trans fat, fat soluble vitamins, cholesterol"
faq_fresh_vs_frozen,Nutrition FAQ,Fresh vs. Frozen Fruits and Vegetables: Which Is Better?,"Frozen produce is just as nutritious as fresh, and in some cases can be more nutritious, since fruits and vegetables are flash-frozen at peak ripeness, locking in their nutrients immediately. When buying frozen produce, it's worth checking the ingredient list to make sure there are no added sugars or high-sodium sauces.","fresh vs frozen, frozen vegetables, frozen fruit, flash frozen, nutrient retention"
faq_strict_diets,Nutrition FAQ,Do You Need a Strict Diet to Be Healthy or Lose Weight?,"Fad diets and highly restrictive eating plans often fail in the long term because they are unsustainable and can leave a person missing essential nutrients. Most dietitians recommend focusing on long-term lifestyle habits instead: portion control, cooking at home more often, and following the 'balanced plate' method, which fills roughly half the plate with vegetables, a quarter with lean protein, and a quarter with whole grains or starchy vegetables.","fad diet, restrictive diet, weight loss, balanced plate method, portion control, sustainable eating"
faq_organic_produce,Nutrition FAQ,Is Organic Produce Always Healthier?,"Choosing organic produce can reduce exposure to agricultural pesticides, but it isn't strictly necessary for a healthy diet, especially if it strains a household budget. A practical approach is to buy organic for foods where the skin is eaten (like apples, strawberries, and spinach) and choose conventional for produce that is peeled before eating (like bananas, avocados, and onions).","organic produce, pesticides, conventional produce, dirty dozen, organic vs conventional"
faq_multivitamins,Nutrition FAQ,Should You Take a Multivitamin or Supplements?,"The best way to get vitamins and minerals is through a varied diet of whole foods. Supplements can help with specific diagnosed deficiencies, such as vitamin D in winter or iron for anemia, but they cannot make up for an overall poor diet. Many supplements also aren't strictly regulated, so it's best to consult a doctor or dietitian before starting any supplement regimen.","multivitamin, supplements, vitamin D deficiency, iron supplement, whole foods, supplement regulation"
faq_probiotics_prebiotics,Nutrition FAQ,What Is the Difference Between Probiotics and Prebiotics?,"Probiotics and prebiotics both support the gut microbiome but play different roles. Probiotics are the live, beneficial bacteria found in fermented foods like yogurt, kefir, sauerkraut, and kimchi, which aid digestion and immune health. Prebiotics are the fibrous food components - found in garlic, onions, bananas, and oats - that feed the beneficial bacteria already living in the gut, helping them thrive.","probiotics, prebiotics, gut microbiome, fermented foods, gut bacteria, fiber"
faq_nutrition_label,Nutrition FAQ,How to Read a Nutrition Label,"A nutrition label starts with the serving size and servings per container - every number on the label is based on that one serving, so eating more than one serving means multiplying the values accordingly. Percent Daily Value (%DV) shows how much a nutrient in one serving contributes to a 2,000-calorie daily diet: 5% DV or less is considered low, and 20% DV or more is considered high. It's generally best to look for labels lower in added sugars, sodium, and saturated fat, and higher in fiber, protein, and essential vitamins and minerals. Checking the ingredient list is also useful, since ingredients are listed in descending order by weight.","nutrition label, percent daily value, serving size, added sugar, ingredient list, food label"
faq_sleep_and_diet,Nutrition FAQ,How Does Sleep Affect Weight and Diet?,"Poor or insufficient sleep disrupts the hormones that regulate appetite - it raises ghrelin, which increases hunger, and lowers leptin, which normally signals fullness, making overeating more likely the next day. Sleep deprivation is also linked to stronger cravings for high-sugar, high-fat, calorie-dense foods, and to reduced insulin sensitivity, which can affect blood sugar control over time. Getting consistent, adequate sleep (generally 7-9 hours for most adults) supports better appetite regulation, food choices, and overall metabolic health.","sleep and diet, sleep and weight, ghrelin, leptin, sleep deprivation cravings, insulin sensitivity"
