id,category,subtopic,title,content,keywords
dis_001,Deficiency Diseases,Vitamin C,Scurvy,"Scurvy is caused by prolonged vitamin C (ascorbic acid) deficiency. Vitamin C is required to synthesize collagen, so deficiency weakens connective tissue, leading to bleeding gums, easy bruising, joint pain, poor wound healing, and fatigue. It is treated and prevented with adequate intake of citrus fruits, bell peppers, and other vitamin C-rich foods.",scurvy; vitamin C deficiency; collagen; bleeding gums; ascorbic acid
dis_002,Deficiency Diseases,Iron / B12 / Folate,Anemia,"Anemia is a condition where the blood lacks enough healthy red blood cells or hemoglobin to carry adequate oxygen. Nutritional anemia is most commonly caused by iron deficiency (iron-deficiency anemia), but can also result from vitamin B12 deficiency (pernicious/megaloblastic anemia) or folate deficiency. Symptoms include fatigue, pale skin, shortness of breath, and dizziness.",anemia; iron deficiency anemia; B12 deficiency; folate deficiency; hemoglobin
dis_003,Deficiency Diseases,Vitamin D,Rickets,"Rickets is a childhood disease caused by vitamin D, calcium, or phosphate deficiency, resulting in softening and weakening of bones. It leads to skeletal deformities such as bowed legs, delayed growth, and bone pain. The adult equivalent, caused by the same deficiencies, is called osteomalacia. Prevention includes adequate vitamin D from sunlight, fortified foods, and fatty fish.",rickets; vitamin D deficiency; osteomalacia; bone softening; calcium
dis_004,Deficiency Diseases,Vitamin B1,Beriberi,"Beriberi is caused by thiamine (vitamin B1) deficiency. 'Wet beriberi' affects the cardiovascular system, causing swelling and heart failure, while 'dry beriberi' affects the nervous system, causing muscle weakness, nerve damage, and difficulty walking. It is historically linked to diets based heavily on polished (white) rice with little else.",beriberi; thiamine deficiency; vitamin B1; wet beriberi; dry beriberi
dis_005,Deficiency Diseases,Vitamin B3,Pellagra,"Pellagra is caused by niacin (vitamin B3) deficiency, often associated with diets heavily reliant on untreated corn/maize. It is classically described by the '4 Ds': dermatitis (skin rash on sun-exposed areas), diarrhea, dementia, and if untreated, death. Treatment involves niacin supplementation and dietary diversification.",pellagra; niacin deficiency; vitamin B3; dermatitis; four Ds
dis_006,Deficiency Diseases,Iodine,Goiter and Iodine Deficiency Disorders,"Iodine deficiency impairs the thyroid gland's ability to produce thyroid hormone, causing the gland to enlarge (goiter) as it tries to compensate. Severe deficiency during pregnancy can cause irreversible cognitive impairment in the child (cretinism). Iodized salt and seafood are the main dietary sources used to prevent it.",iodine deficiency; goiter; thyroid; cretinism; iodized salt
dis_007,Deficiency Diseases,Protein-Energy,Kwashiorkor and Marasmus,"Kwashiorkor and marasmus are severe forms of protein-energy malnutrition, most common in children in food-insecure regions. Kwashiorkor results primarily from protein deficiency despite adequate calorie intake, causing edema (swelling), a distended belly, and fatty liver. Marasmus results from severe overall calorie and nutrient deficiency, causing extreme wasting of muscle and fat with no edema.",kwashiorkor; marasmus; protein energy malnutrition; edema; child malnutrition
dis_008,Deficiency Diseases,Vitamin A,Night Blindness / Xerophthalmia,"Vitamin A deficiency impairs the retina's ability to adapt to low light, causing night blindness, and can progress to xerophthalmia (severe dryness of the eyes), corneal damage, and in advanced untreated cases, irreversible blindness. It remains a leading cause of preventable childhood blindness in developing countries.",vitamin A deficiency; night blindness; xerophthalmia; retinol; childhood blindness
